{
  "$schema": "https://json-schema.org/draft/2020-12/schema",
  "$id": "https://argus.io/schemas/v1/card/card.schema.json",
  "$ref": "#/$defs/CardManifest",
  "$defs": {
    "SlotType": {"enum": ["string", "number", "boolean", "array", "object"]},
    "Slot": {
      "type": "object",
      "additionalProperties": false,
      "required": ["name", "kind", "value_type", "required"],
      "properties": {
        "name": {"type": "string", "pattern": "^[a-z][a-z0-9_]*$"},
        "kind": {"enum": ["data", "query", "action"]},
        "value_type": {"$ref": "#/$defs/SlotType"},
        "required": {"type": "boolean"},
        "ai_generated": {"type": "boolean", "default": false}
      }
    },
    "CardManifest": {
      "type": "object",
      "additionalProperties": false,
      "required": ["schema_version", "card_id", "revision", "source", "entrypoint_hash", "bridge_version", "slots", "allowed_resources", "supported_locales", "default_locale", "supported_color_schemes", "max_message_bytes"],
      "properties": {
        "schema_version": {"const": "argus.card_manifest/v1"},
        "card_id": {"type": "string", "minLength": 1},
        "revision": {"type": "integer", "minimum": 1},
        "source": {"enum": ["system", "enterprise"]},
        "entrypoint_hash": {"type": "string", "minLength": 32},
        "bridge_version": {"const": "argus.card_bridge/v1"},
        "slots": {"type": "array", "items": {"$ref": "#/$defs/Slot"}},
        "allowed_resources": {"type": "array", "uniqueItems": true, "items": {"enum": ["inline_style", "inline_script", "image_data", "font_data"]}},
        "supported_locales": {"type": "array", "minItems": 1, "uniqueItems": true, "items": {"enum": ["zh-CN", "en-US"]}},
        "default_locale": {"enum": ["zh-CN", "en-US"]},
        "supported_color_schemes": {"type": "array", "minItems": 1, "uniqueItems": true, "items": {"enum": ["light", "dark"]}},
        "max_message_bytes": {"type": "integer", "minimum": 1024, "maximum": 1048576}
      }
    },
    "DataBinding": {
      "type": "object",
      "additionalProperties": false,
      "required": ["slot_name", "tool_call_id", "path", "schema_version"],
      "properties": {
        "slot_name": {"type": "string"},
        "tool_call_id": {"type": "string"},
        "path": {"type": "string", "pattern": "^\\$"},
        "schema_version": {"type": "string"}
      }
    },
    "QueryBinding": {
      "type": "object",
      "additionalProperties": false,
      "required": ["binding_id", "status", "expires_at"],
      "properties": {
        "binding_id": {"type": "string", "minLength": 1},
        "status": {"enum": ["active", "consumed", "expired", "invalidated"]},
        "expires_at": {"type": "string", "format": "date-time"}
      }
    },
    "RenderPlan": {
      "type": "object",
      "additionalProperties": false,
      "required": ["schema_version", "card_id", "card_revision", "card_instance_id", "data_bindings", "query_binding_ids", "action_binding_ids", "locale", "color_scheme"],
      "properties": {
        "schema_version": {"const": "argus.render_plan/v1"},
        "card_id": {"type": "string"},
        "card_revision": {"type": "integer", "minimum": 1},
        "card_instance_id": {"type": "string"},
        "data_bindings": {"type": "array", "items": {"$ref": "#/$defs/DataBinding"}},
        "query_binding_ids": {"type": "object", "additionalProperties": {"type": "string"}},
        "action_binding_ids": {"type": "object", "additionalProperties": {"type": "string"}},
        "locale": {"enum": ["zh-CN", "en-US"]},
        "color_scheme": {"enum": ["light", "dark"]}
      }
    },
    "BridgeMessage": {
      "type": "object",
      "additionalProperties": false,
      "required": ["bridge_version", "message_id", "sequence", "nonce", "type", "payload"],
      "properties": {
        "bridge_version": {"const": "argus.card_bridge/v1"},
        "message_id": {"type": "string", "minLength": 1},
        "sequence": {"type": "integer", "minimum": 0},
        "nonce": {"type": "string", "minLength": 16},
        "type": {"enum": ["host.hello", "card.ready", "host.context", "data.update", "query.invoke", "action.invoke", "card.resize", "binding.result", "bridge.error", "bridge.destroyed"]},
        "payload": {"$ref": "../common/public-json.schema.json#/$defs/PublicJsonObject"}
      },
      "allOf": [
        {
          "if": {"properties": {"type": {"const": "query.invoke"}}, "required": ["type"]},
          "then": {
            "properties": {
              "payload": {
                "type": "object",
                "additionalProperties": false,
                "required": ["query_binding_id", "request_id"],
                "properties": {
                  "query_binding_id": {"type": "string", "minLength": 1},
                  "request_id": {"type": "string", "minLength": 16, "maxLength": 128}
                }
              }
            }
          }
        },
        {
          "if": {"properties": {"type": {"const": "action.invoke"}}, "required": ["type"]},
          "then": {
            "properties": {
              "payload": {
                "type": "object",
                "additionalProperties": false,
                "required": ["action_binding_id", "request_id"],
                "properties": {
                  "action_binding_id": {"type": "string", "minLength": 1},
                  "request_id": {"type": "string", "minLength": 16, "maxLength": 128}
                }
              }
            }
          }
        }
      ]
    }
  }
}
