{
  "schema_version": "argus.card_manifest/v1",
  "card_id": "card_boundary",
  "revision": 1,
  "source": "enterprise",
  "entrypoint_hash": "0123456789abcdef0123456789abcdef0123456789abcdef0123456789abcdef",
  "bridge_version": "argus.card_bridge/v1",
  "slots": [],
  "allowed_resources": [],
  "supported_locales": ["zh-CN"],
  "default_locale": "zh-CN",
  "supported_color_schemes": ["dark"],
  "max_message_bytes": 1048576
}
